{"event_id":"le_55555555555555555555555555555555","schema_version":"1.0.0","decision_id":"dec_99999999999999999999999999999999","run_id":"run_11111111111111111111111111111111","plan_id":"pln_22222222222222222222222222222222","bundle_id":"bnd_aaaaaaaaaaaaaaaaaaaaaaaaaaaaaaaa","bundle_sha256":"97f5e95a380ae268f15a1cb27b661e0dd1e5d5fbde8485b3cb2c792a3731bd61","protocol_id":"example-protocol","sequence":0,"occurred_at":"2026-08-15T20:01:00Z","event_type":"pending","previous_event_sha256":null,"event_sha256":"2d95978b05c76869ebd1a2e4af983fcf5d0379ad8fb23a6bc2728b58f568604e","actor":{"kind":"agent","id_sha256":"aaaaaaaaaaaaaaaaaaaaaaaaaaaaaaaaaaaaaaaaaaaaaaaaaaaaaaaaaaaaaaaa"}}
